{
  "spec_version": "v1.5.5",
  "event_type": "PREFECT_RUN",
  "timestamp": "2026-01-16T22:26:29.260558",
  "addon": "prefect",
  "status": "NOT_INSTALLED",
  "card_id": null,
  "run_id": null,
  "details": {},
  "pointers": [],
  "error_message": "pip install prefect to enable orchestration",
  "schema_validation": "PASSED"
}